{
  "schema_version": "1.0",
  "artifact_id": "pc-hermes-factory-pilot-001",
  "product_id": "hermes-factory-pilot",
  "created_at": "2026-07-26T17:07:00Z",
  "producer": {
    "role": "product-director",
    "tier": "deterministic",
    "provider": null,
    "model": null
  },
  "policy_digest": "8fa83aa61b556c59ccdc3e756c16e51193614ad6d19caadaa39f49f7ac29bc02",
  "status": "completed",
  "summary": "A credential-free low-risk staging dashboard validates health, persistence, and container isolation for the factory.",
  "problem": "The factory needs a safe product surface for staging, black-box checks, and rollback rehearsal before external credentials are connected.",
  "outcome": "A localhost-only dashboard runs as a hardened non-root container and reports live, ready, database, and risk status.",
  "personas": [
    {
      "id": "operator",
      "description": "Factory operator verifying staging readiness without customer data or credentials."
    }
  ],
  "critical_journeys": [
    {
      "id": "CJ-001",
      "actor": "operator",
      "trigger": "Operator opens the local pilot URL.",
      "steps": [
        "Load the dashboard.",
        "Probe live and ready endpoints.",
        "Inspect the persistent event count."
      ],
      "success": "The dashboard and all health endpoints report PASS with a valid SQLite store."
    }
  ],
  "scope": [
    "Static status dashboard",
    "Live and readiness endpoints",
    "Persistent SQLite startup event ledger",
    "Hardened localhost-only Docker staging"
  ],
  "out_of_scope": [
    "Credentials and OAuth",
    "Telegram and GitHub integrations",
    "Customer data and payments",
    "Public production exposure"
  ],
  "functional_requirements": [
    {
      "id": "FR-001",
      "text": "The service shall expose live, ready, and status endpoints.",
      "journey_ids": ["CJ-001"]
    },
    {
      "id": "FR-002",
      "text": "The service shall persist startup events in SQLite.",
      "journey_ids": ["CJ-001"]
    }
  ],
  "nonfunctional_requirements": [
    {
      "id": "NFR-001",
      "text": "The host binding shall be localhost-only.",
      "verification": "Compose port mapping and curl from the VPS loopback."
    },
    {
      "id": "NFR-002",
      "text": "The container shall run as non-root with a read-only filesystem and bounded resources.",
      "verification": "Dockerfile and Compose security settings plus container inspection."
    }
  ],
  "acceptance_criteria": [
    {
      "id": "AC-001",
      "given": "The pilot container is running",
      "when": "The operator requests all health endpoints",
      "then": "Each endpoint returns HTTP 200 and status PASS",
      "requirement_ids": ["FR-001"],
      "critical": true
    },
    {
      "id": "AC-002",
      "given": "The pilot has restarted",
      "when": "The operator reads the status endpoint",
      "then": "The persisted event count is greater than its pre-restart value",
      "requirement_ids": ["FR-002"],
      "critical": true
    }
  ],
  "assumptions": [
    {
      "id": "A-001",
      "text": "The pilot remains staging-only until external acceptance is complete.",
      "reversible": true,
      "expiry_condition": "GitHub, provider, Telegram, and offsite evidence are connected."
    }
  ],
  "irreversible_decisions": [],
  "risk_markers": ["low_risk", "no_credentials", "localhost_only"],
  "data_classification": "public",
  "repository_visibility": "public",
  "non_blocking_questions": [],
  "findings": [
    {
      "code": "PILOT-LOW-RISK",
      "severity": "info",
      "text": "No external integrations or sensitive data are present in the neutral pilot."
    }
  ],
  "evidence_refs": [
    "pilot/README.md",
    "pilot/docs/ARCHITECTURE.md",
    "evidence/pilot/staging-smoke.json"
  ]
}
